{
    "concurrency": {
        "branches": 4,
        "organizations": 3,
        "repositories": 6
    },
    "cutoffDate": "2024-01-01",
    "excludeDirGlobs": [
        "**/node_modules/**",
        "**/dist/**",
        "**/build/**",
        "**/vendor/**"
    ],
    "githubHost": "github.com",
    "includeArchived": false,
    "includeForks": false,
    "maxBranchesPerRepo": 25,
    "maxReposPerOrg": null,
    "organizations": null,
    "excludeOrganizations": [],
    "includePersonalNamespace": false,
    "packages": [
        {
            "name": "expo"
        }
    ],
    "paths": {
        "outputDir": "./output",
        "sqlitePath": "./data/audit.db"
    }
}